{
  "version": "1",
  "triggerSource": "DefineAuthChallenge_Authentication",
  "region": "us-east-1",
  "userPoolId": "us-east-1_EXAMPLE",
  "userName": "JaneDoe",
  "callerContext": {
    "awsSdkVersion": "aws-sdk-unknown-unknown",
    "clientId": "1example23456789"
  },
  "request": {
    "userAttributes": {
      "sub": "a1b2c3d4"
    },
    "session": [ ]
  },
  "response": {
    "challengeName": "CUSTOM_CHALLENGE",
    "issueTokens": false,
    "failAuthentication": false
  }
}