{
  "version": "1",
  "triggerSource": "TokenGeneration_Authentication",
  "region": "us-east-1",
  "userPoolId": "us-east-1_EXAMPLE",
  "userName": "JaneDoe",
  "callerContext": {
    "awsSdkVersion": "aws-sdk-unknown-unknown",
    "clientId": "1example23456789"
  },
  "request": {
    "userAttributes": {
      "sub": "a1b2c3d4",
      "email": "jane@example.com"
    },
    "groupConfiguration": {
      "groupsToOverride": [ "group-1" ],
      "iamRolesToOverride": [ "arn:aws:iam::123456789012:role/role1" ],
      "preferredRole": "arn:aws:iam::123456789012:role/role1"
    }
  },
  "response": {
    "claimsOverrideDetails": {
      "claimsToAddOrOverride": { },
      "claimsToSuppress": [ ],
      "groupOverrideDetails": null
    }
  }
}